{
  "id": "evt.market_jitters",
  "category": "exogenous",
  "title": "evt.market_jitters.title",
  "desc": "evt.market_jitters.desc",
  "fires_once": false,
  "mean_time_to_happen": {
    "base_days": 365,
    "modifiers": [
      {
        "condition": {
          "var": "bank_fragility",
          "op": ">=",
          "value": 0.4
        },
        "factor": 0.6
      }
    ]
  },
  "options": [
    {
      "id": "reassure",
      "name": "evt.market_jitters.opt.reassure",
      "effects": [
        {
          "op": "add",
          "target": "credibility",
          "value": 0.03
        }
      ]
    },
    {
      "id": "stay_silent",
      "name": "evt.market_jitters.opt.stay_silent",
      "effects": []
    }
  ]
}
